{"$schema":"https://json-schema.org/draft/2020-12/schema","$id":"https://agent-plugins.org/schemas/feedback-annotation/1.0.0/feedback-proposal.schema.json","title":"Versioned Feedback Proposal","type":"object","additionalProperties":false,"required":["schemaVersion","proposalId","annotationId","annotationHash","interpretationId","interpretationHash","baseResourceId","baseRevision","baseHash","action","rationale","operations","affectedResourceIds","requiredTests","proposedAt","proposer","proposalHash"],"properties":{"schemaVersion":{"const":"1.0.0"},"proposalId":{"$ref":"#/$defs/id"},"annotationId":{"$ref":"#/$defs/id"},"annotationHash":{"$ref":"#/$defs/hash"},"interpretationId":{"$ref":"#/$defs/id"},"interpretationHash":{"$ref":"#/$defs/hash"},"baseResourceId":{"$ref":"#/$defs/id"},"baseRevision":{"type":"integer","minimum":0},"baseHash":{"$ref":"#/$defs/hash"},"action":{"enum":["accept","reject","correct"]},"rationale":{"type":"string","minLength":1,"maxLength":10000},"operations":{"type":"array","maxItems":256,"items":{"$ref":"#/$defs/operation"}},"affectedResourceIds":{"$ref":"#/$defs/ids"},"requiredTests":{"$ref":"#/$defs/ids"},"proposedAt":{"$ref":"#/$defs/instant"},"proposer":{"$ref":"#/$defs/reviewer"},"proposalHash":{"$ref":"#/$defs/hash"}},"allOf":[{"if":{"properties":{"action":{"const":"reject"}},"required":["action"]},"then":{"properties":{"operations":{"maxItems":0,"type":"array"}}}}],"$defs":{"id":{"type":"string","pattern":"^[A-Za-z0-9][A-Za-z0-9._:-]{0,127}$"},"hash":{"type":"string","pattern":"^[a-f0-9]{64}$"},"instant":{"type":"string","format":"date-time","pattern":"Z$"},"ids":{"type":"array","maxItems":1024,"uniqueItems":true,"items":{"$ref":"#/$defs/id"}},"reviewer":{"type":"object","additionalProperties":false,"required":["reviewerId","role"],"properties":{"reviewerId":{"$ref":"#/$defs/id"},"displayName":{"type":"string","minLength":1,"maxLength":200},"role":{"$ref":"#/$defs/id"}}},"operation":{"oneOf":[{"type":"object","additionalProperties":false,"required":["op","path","value"],"properties":{"op":{"enum":["add","replace"]},"path":{"type":"string","pattern":"^/(?:[^~/]|~0|~1)*(?:/(?:[^~/]|~0|~1)*)*$"},"value":{}}},{"type":"object","additionalProperties":false,"required":["op","path"],"properties":{"op":{"const":"remove"},"path":{"type":"string","pattern":"^/(?:[^~/]|~0|~1)*(?:/(?:[^~/]|~0|~1)*)*$"}}}]}}}
